{
  "$comment": "GENERATED by github.com/lnorton89/golc/internal/contracts. DO NOT EDIT. Schema: linear-plan.",
  "$id": "https://github.com/lnorton89/golc/internal/contracts/linear-plan-schema",
  "$schema": "https://json-schema.org/draft/2020-12/schema",
  "additionalProperties": false,
  "properties": {
    "conflicts": {
      "description": "Blocked D-13 field disagreements; a local id recorded here never also owns an operation.",
      "items": {
        "additionalProperties": false,
        "properties": {
          "base_value": {
            "oneOf": [
              {
                "description": "Last-synchronized baseline value this field's D-13 three-way comparison is anchored to.",
                "type": "string"
              },
              {
                "type": "null"
              }
            ]
          },
          "field": {
            "description": "Owned field name both sides changed away from the last synchronized baseline.",
            "minLength": 1,
            "type": "string"
          },
          "linear_value": {
            "oneOf": [
              {
                "description": "Current observed Linear value.",
                "type": "string"
              },
              {
                "type": "null"
              }
            ]
          },
          "local_id": {
            "description": "Durable local id with a blocked D-13 field disagreement.",
            "pattern": "^[a-z]+:[A-Za-z0-9._-]+$",
            "type": "string"
          },
          "repository_value": {
            "oneOf": [
              {
                "description": "Current repository-owned value.",
                "type": "string"
              },
              {
                "type": "null"
              }
            ]
          },
          "resolution_command": {
            "description": "Exact command a contributor runs to explicitly resolve this conflict.",
            "minLength": 1,
            "type": "string"
          }
        },
        "required": [
          "local_id",
          "field",
          "base_value",
          "repository_value",
          "linear_value",
          "resolution_command"
        ],
        "type": "object"
      },
      "type": "array"
    },
    "intent_digest": {
      "description": "SHA-256 digest of the sorted repository intent set this plan was computed from.",
      "pattern": "^[0-9a-f]{64}$",
      "type": "string"
    },
    "mapping_digest": {
      "description": "SHA-256 digest of the sorted credential-free remote mapping set this plan was computed from.",
      "pattern": "^[0-9a-f]{64}$",
      "type": "string"
    },
    "operations": {
      "description": "Planned mutations in the fixed D-17 hierarchy/local-id order; never reordered after generation.",
      "items": {
        "additionalProperties": false,
        "properties": {
          "after": {
            "additionalProperties": {
              "type": "string"
            },
            "description": "Canonically encoded desired repository-owned field values after this operation.",
            "type": "object"
          },
          "before": {
            "additionalProperties": {
              "type": "string"
            },
            "description": "Canonically encoded observed remote owned-field values before this operation; empty when unobserved.",
            "type": "object"
          },
          "depends_on": {
            "description": "Parent local id(s) that must already be complete or linked before this operation may run.",
            "items": {
              "type": "string"
            },
            "type": "array",
            "uniqueItems": true
          },
          "discovery_marker": {
            "description": "Exact D-14 identity footer this operation's remote object must carry.",
            "minLength": 1,
            "type": "string"
          },
          "expected_updated_at": {
            "oneOf": [
              {
                "description": "Captured remote updated_at precondition; null when no prior observation exists.",
                "type": "string"
              },
              {
                "type": "null"
              }
            ]
          },
          "kind": {
            "description": "Catalog kind; the repository-root project kind is never remote-managed and never appears here.",
            "enum": [
              "milestone",
              "phase",
              "req",
              "plan",
              "task"
            ],
            "type": "string"
          },
          "linear_type": {
            "description": "Target Linear object type this local id maps to.",
            "enum": [
              "project",
              "project_milestone",
              "issue"
            ],
            "type": "string"
          },
          "linear_uuid": {
            "oneOf": [
              {
                "description": "Already-linked immutable Linear UUID; null for a not-yet-linked operation discovered by marker instead (D-14).",
                "type": "string"
              },
              {
                "type": "null"
              }
            ]
          },
          "local_id": {
            "description": "Durable local id this operation mutates; identity never changes on rename (D-14).",
            "pattern": "^[a-z]+:[A-Za-z0-9._-]+$",
            "type": "string"
          },
          "owned_fields": {
            "description": "Sorted repository-owned field names this operation may write; never a Linear-owned operational field (D-11).",
            "items": {
              "type": "string"
            },
            "type": "array",
            "uniqueItems": true
          },
          "parent_local_id": {
            "description": "Structural parent local id; empty only for a top-level milestone operation.",
            "pattern": "^([a-z]+:[A-Za-z0-9._-]+)?$",
            "type": "string"
          }
        },
        "required": [
          "local_id",
          "kind",
          "linear_type",
          "linear_uuid",
          "discovery_marker",
          "parent_local_id",
          "before",
          "after",
          "owned_fields",
          "expected_updated_at",
          "depends_on"
        ],
        "type": "object"
      },
      "type": "array"
    },
    "plan_id": {
      "description": "SHA-256 digest binding this plan's own canonical body; plan_id equals sha256(canonical_body).",
      "pattern": "^[0-9a-f]{64}$",
      "type": "string"
    },
    "remote_scope_digest": {
      "description": "SHA-256 digest of the sorted exhaustively captured remote observation scope this plan was computed from.",
      "pattern": "^[0-9a-f]{64}$",
      "type": "string"
    },
    "schema_version": {
      "description": "Fixed reconcile.SchemaVersion this plan was built under.",
      "enum": [
        1
      ],
      "type": "integer"
    }
  },
  "required": [
    "schema_version",
    "intent_digest",
    "mapping_digest",
    "remote_scope_digest",
    "operations",
    "conflicts",
    "plan_id"
  ],
  "type": "object"
}
